[
  {
    "id": 1,
    "name": "Tierra Nuestra S.L.",
    "tax_id": "B61833970",
    "city": "Palma",
    "province": "Baleares",
    "phone": "+34 971 054 335",
    "email": "pedidos.tierra1@example.com",
    "lead_time_days": 5,
    "active": true
  },
  {
    "id": 2,
    "name": "Origen e Hijos S.L.",
    "tax_id": "B46910308",
    "city": "Madrid",
    "province": "Madrid",
    "phone": "+34 911 681 052",
    "email": "pedidos.origen2@example.com",
    "lead_time_days": 1,
    "active": false
  },
  {
    "id": 3,
    "name": "El Molinar Distribuciones S.L.",
    "tax_id": "B61958255",
    "city": "Zaragoza",
    "province": "Zaragoza",
    "phone": "+34 976 369 043",
    "email": "pedidos.el3@example.com",
    "lead_time_days": 2,
    "active": true
  },
  {
    "id": 4,
    "name": "Los Almendros Ibérica S.A.",
    "tax_id": "A12871723",
    "city": "San Sebastián",
    "province": "Gipuzkoa",
    "phone": "+34 943 524 667",
    "email": "pedidos.los4@example.com",
    "lead_time_days": 2,
    "active": true
  },
  {
    "id": 5,
    "name": "Puente Viejo Ibérica S.A.",
    "tax_id": "A30226199",
    "city": "Sevilla",
    "province": "Sevilla",
    "phone": "+34 954 518 207",
    "email": "pedidos.puente5@example.com",
    "lead_time_days": 14,
    "active": true
  },
  {
    "id": 6,
    "name": "Valdehermoso S.A.",
    "tax_id": "A10492476",
    "city": "Madrid",
    "province": "Madrid",
    "phone": "+34 910 042 269",
    "email": "pedidos.valdehermoso6@example.com",
    "lead_time_days": 1,
    "active": true
  },
  {
    "id": 7,
    "name": "La Almazara S.A.",
    "tax_id": "A26742992",
    "city": "Melilla",
    "province": "Melilla",
    "phone": "+34 952 148 582",
    "email": "pedidos.la7@example.com",
    "lead_time_days": 2,
    "active": false
  },
  {
    "id": 8,
    "name": "Tierra Nuestra e Hijos S.L.",
    "tax_id": "B33765683",
    "city": "Madrid",
    "province": "Madrid",
    "phone": "+34 912 948 284",
    "email": "pedidos.tierra8@example.com",
    "lead_time_days": 5,
    "active": true
  },
  {
    "id": 9,
    "name": "Ribera Alta e Hijos S.L.",
    "tax_id": "B54631795",
    "city": "Barcelona",
    "province": "Barcelona",
    "phone": "+34 930 061 881",
    "email": "pedidos.ribera9@example.com",
    "lead_time_days": 10,
    "active": true
  },
  {
    "id": 10,
    "name": "Sabor de Antaño S.A.",
    "tax_id": "A80664203",
    "city": "Córdoba",
    "province": "Córdoba",
    "phone": "+34 957 747 693",
    "email": "pedidos.sabor10@example.com",
    "lead_time_days": 5,
    "active": true
  },
  {
    "id": 11,
    "name": "Sabor de Antaño e Hijos S.L.",
    "tax_id": "B24340789",
    "city": "Terrassa",
    "province": "Barcelona",
    "phone": "+34 935 316 604",
    "email": "pedidos.sabor11@example.com",
    "lead_time_days": 2,
    "active": true
  },
  {
    "id": 12,
    "name": "Campo Sur S.L.",
    "tax_id": "B89541240",
    "city": "Castellón de la Plana",
    "province": "Castellón",
    "phone": "+34 964 509 205",
    "email": "pedidos.campo12@example.com",
    "lead_time_days": 2,
    "active": true
  },
  {
    "id": 13,
    "name": "Campo Sur Ibérica S.A.",
    "tax_id": "A70010922",
    "city": "Alicante",
    "province": "Alicante",
    "phone": "+34 965 338 822",
    "email": "pedidos.campo13@example.com",
    "lead_time_days": 5,
    "active": true
  },
  {
    "id": 14,
    "name": "Selecta Ibérica S.A.",
    "tax_id": "A13463146",
    "city": "Madrid",
    "province": "Madrid",
    "phone": "+34 919 675 985",
    "email": "pedidos.selecta14@example.com",
    "lead_time_days": 2,
    "active": true
  },
  {
    "id": 15,
    "name": "Monteclaro Distribuciones S.L.",
    "tax_id": "B50553983",
    "city": "Huelva",
    "province": "Huelva",
    "phone": "+34 959 737 739",
    "email": "pedidos.monteclaro15@example.com",
    "lead_time_days": 7,
    "active": true
  },
  {
    "id": 16,
    "name": "Doña Elena Ibérica S.A.",
    "tax_id": "A92589606",
    "city": "Jaén",
    "province": "Jaén",
    "phone": "+34 953 356 903",
    "email": "pedidos.dona16@example.com",
    "lead_time_days": 5,
    "active": true
  },
  {
    "id": 17,
    "name": "Campo Sur e Hijos S.L.",
    "tax_id": "B95546048",
    "city": "Santa Cruz de Tenerife",
    "province": "Santa Cruz de Tenerife",
    "phone": "+34 922 579 628",
    "email": "pedidos.campo17@example.com",
    "lead_time_days": 1,
    "active": false
  },
  {
    "id": 18,
    "name": "La Almazara S.L.",
    "tax_id": "B60847411",
    "city": "Cartagena",
    "province": "Murcia",
    "phone": "+34 968 861 205",
    "email": "pedidos.la18@example.com",
    "lead_time_days": 3,
    "active": true
  },
  {
    "id": 19,
    "name": "Vega Real Distribuciones S.L.",
    "tax_id": "B88741641",
    "city": "Sabadell",
    "province": "Barcelona",
    "phone": "+34 935 839 976",
    "email": "pedidos.vega19@example.com",
    "lead_time_days": 5,
    "active": true
  },
  {
    "id": 20,
    "name": "Origen S.L.",
    "tax_id": "B41984452",
    "city": "Murcia",
    "province": "Murcia",
    "phone": "+34 968 297 714",
    "email": "pedidos.origen20@example.com",
    "lead_time_days": 3,
    "active": true
  },
  {
    "id": 21,
    "name": "Valdehermoso S.L.",
    "tax_id": "B71487441",
    "city": "León",
    "province": "León",
    "phone": "+34 987 475 641",
    "email": "pedidos.valdehermoso21@example.com",
    "lead_time_days": 2,
    "active": true
  },
  {
    "id": 22,
    "name": "Los Almendros S.A.",
    "tax_id": "A96080527",
    "city": "Madrid",
    "province": "Madrid",
    "phone": "+34 918 195 167",
    "email": "pedidos.los22@example.com",
    "lead_time_days": 3,
    "active": true
  },
  {
    "id": 23,
    "name": "Doña Elena S.A.",
    "tax_id": "A35702885",
    "city": "Oviedo",
    "province": "Asturias",
    "phone": "+34 985 600 416",
    "email": "pedidos.dona23@example.com",
    "lead_time_days": 2,
    "active": true
  },
  {
    "id": 24,
    "name": "Vega Real Ibérica S.A.",
    "tax_id": "A34507286",
    "city": "Zaragoza",
    "province": "Zaragoza",
    "phone": "+34 976 481 209",
    "email": "pedidos.vega24@example.com",
    "lead_time_days": 1,
    "active": false
  },
  {
    "id": 25,
    "name": "Tierra Nuestra Ibérica S.A.",
    "tax_id": "A21976713",
    "city": "Logroño",
    "province": "La Rioja",
    "phone": "+34 941 618 352",
    "email": "pedidos.tierra25@example.com",
    "lead_time_days": 5,
    "active": true
  },
  {
    "id": 26,
    "name": "Selecta S.L.",
    "tax_id": "B35269513",
    "city": "Vitoria-Gasteiz",
    "province": "Álava",
    "phone": "+34 945 192 294",
    "email": "pedidos.selecta26@example.com",
    "lead_time_days": 14,
    "active": true
  },
  {
    "id": 27,
    "name": "Campo Sur Distribuciones S.L.",
    "tax_id": "B14417604",
    "city": "Logroño",
    "province": "La Rioja",
    "phone": "+34 941 619 443",
    "email": "pedidos.campo27@example.com",
    "lead_time_days": 7,
    "active": true
  },
  {
    "id": 28,
    "name": "La Almazara Distribuciones S.L.",
    "tax_id": "B50748496",
    "city": "Sevilla",
    "province": "Sevilla",
    "phone": "+34 954 886 344",
    "email": "pedidos.la28@example.com",
    "lead_time_days": 2,
    "active": true
  },
  {
    "id": 29,
    "name": "Vega Real e Hijos S.L.",
    "tax_id": "B43927276",
    "city": "Huelva",
    "province": "Huelva",
    "phone": "+34 959 273 616",
    "email": "pedidos.vega29@example.com",
    "lead_time_days": 3,
    "active": true
  },
  {
    "id": 30,
    "name": "Ribera Alta S.L.",
    "tax_id": "B48536270",
    "city": "Valencia",
    "province": "Valencia",
    "phone": "+34 966 802 127",
    "email": "pedidos.ribera30@example.com",
    "lead_time_days": 7,
    "active": true
  },
  {
    "id": 31,
    "name": "Los Almendros e Hijos S.L.",
    "tax_id": "B30844696",
    "city": "Huelva",
    "province": "Huelva",
    "phone": "+34 959 659 059",
    "email": "pedidos.los31@example.com",
    "lead_time_days": 3,
    "active": true
  },
  {
    "id": 32,
    "name": "Doña Elena e Hijos S.L.",
    "tax_id": "B13800061",
    "city": "Oviedo",
    "province": "Asturias",
    "phone": "+34 985 957 026",
    "email": "pedidos.dona32@example.com",
    "lead_time_days": 1,
    "active": true
  },
  {
    "id": 33,
    "name": "Los Almendros S.L.",
    "tax_id": "B39213345",
    "city": "Santa Cruz de Tenerife",
    "province": "Santa Cruz de Tenerife",
    "phone": "+34 922 394 666",
    "email": "pedidos.los33@example.com",
    "lead_time_days": 5,
    "active": true
  },
  {
    "id": 34,
    "name": "Buenamesa e Hijos S.L.",
    "tax_id": "B42799829",
    "city": "Barcelona",
    "province": "Barcelona",
    "phone": "+34 936 296 879",
    "email": "pedidos.buenamesa34@example.com",
    "lead_time_days": 14,
    "active": true
  },
  {
    "id": 35,
    "name": "La Almazara Ibérica S.A.",
    "tax_id": "A48498854",
    "city": "Vigo",
    "province": "Pontevedra",
    "phone": "+34 986 250 187",
    "email": "pedidos.la35@example.com",
    "lead_time_days": 5,
    "active": true
  },
  {
    "id": 36,
    "name": "Casa Robles Ibérica S.A.",
    "tax_id": "A93804542",
    "city": "Salamanca",
    "province": "Salamanca",
    "phone": "+34 923 869 613",
    "email": "pedidos.casa36@example.com",
    "lead_time_days": 3,
    "active": true
  },
  {
    "id": 37,
    "name": "Monteclaro e Hijos S.L.",
    "tax_id": "B14065032",
    "city": "Córdoba",
    "province": "Córdoba",
    "phone": "+34 957 307 371",
    "email": "pedidos.monteclaro37@example.com",
    "lead_time_days": 5,
    "active": true
  },
  {
    "id": 38,
    "name": "El Molinar S.L.",
    "tax_id": "B57944827",
    "city": "Barcelona",
    "province": "Barcelona",
    "phone": "+34 931 253 391",
    "email": "pedidos.el38@example.com",
    "lead_time_days": 1,
    "active": true
  },
  {
    "id": 39,
    "name": "Tierra Nuestra S.A.",
    "tax_id": "A52551634",
    "city": "Córdoba",